{
  "$schema": "https://cognitive-biases.github.io/schemas/situation-guides.schema.json",
  "version": 1,
  "updatedAt": "2026-09-10",
  "description": "Deep, situation-first decision guides. Each record extends a canonical situation with a problem question, five-step review, worked example, decision record, evidence boundary and links to existing practice, comparisons or reviewed research.",
  "guides": [
    {
      "situation": "hiring-interviews",
      "tier": "deep",
      "reviewedAt": "2026-09-10",
      "hook": "Confidence is cheap. Comparable evidence is slower.",
      "problemQuestion": "How do we compare candidates without letting the first ten minutes write the rest of the interview?",
      "whyHard": [
        "Interviews compress a lot of noisy information into a short meeting. Confidence, fluency, similarity and one memorable answer can feel diagnostic before the job evidence is complete. Once an early story forms, later answers are easy to read through that story.",
        "A stronger process does not require pretending human judgment can be removed. It makes the judgment inspectable: fix the criteria first, ask comparable questions, record evidence before the overall rating and compare independent views before the group starts negotiating a shared story."
      ],
      "reviewProtocol": [
        "Write four to six role criteria and any real disqualifiers before the interview starts.",
        "Ask the same core evidence questions for every candidate, then add follow-ups only where the answer needs clarification.",
        "Record evidence against each criterion before writing an overall rating or discussing the candidate with the group.",
        "Ask what evidence would lower the current top candidate and what evidence would raise the next candidate.",
        "Compare independent ratings, disagreements and missing evidence before making the final ranking."
      ],
      "workedExample": {
        "title": "The polished candidate",
        "setup": "A candidate gives a confident first answer and has an easy conversation with the panel. The next candidate is less polished but gives stronger examples for two critical parts of the role.",
        "weakReview": "The panel describes the first candidate as a better fit and then searches the notes for examples that support that impression.",
        "strongerReview": "The panel scores both candidates against the same prewritten criteria, separates communication style from job evidence, records uncertainty and discusses the largest rating differences before choosing."
      },
      "decisionRecord": [
        "Role criteria fixed before the interview.",
        "Evidence for and against each important criterion.",
        "Independent rating before group discussion.",
        "Largest uncertainty or missing evidence.",
        "What new evidence would change the ranking."
      ],
      "comparisonSlugs": ["hindsight-bias-vs-outcome-bias"],
      "researchNoteSlugs": [],
      "evidenceBoundary": "Anchoring, confirmation bias and outcome bias are useful questions to test here, not diagnoses of an interviewer. Structured criteria can improve consistency, but they do not guarantee that the final hire will be correct.",
      "sourceBoundary": "This guide combines existing project evidence, reviewed comparison material and scenario practice. It does not create a new scientific claim."
    },
    {
      "situation": "project-estimation",
      "tier": "deep",
      "reviewedAt": "2026-09-10",
      "searchIntent": "forecasting-estimation",
      "hook": "A target date is not a forecast wearing a tie.",
      "problemQuestion": "How do we estimate a project when the business already has a date in mind?",
      "whyHard": [
        "A target is useful for planning, but it becomes dangerous when it quietly turns into the starting estimate. Detailed plans then explain how the date could work while comparable completed work, rework and ordinary delays stay outside the frame.",
        "The outside view is not an excuse to ignore project details. It is a second source of evidence. A useful estimate keeps the target, the forecast and the assumptions separate so the team can see whether it is committing to a date or predicting one."
      ],
      "reviewProtocol": [
        "Make an independent first estimate or range before discussing the target date in detail.",
        "Choose a reference class of genuinely comparable completed work and record the observed range.",
        "List the few assumptions that would move the current project toward the fast or slow end of that range.",
        "Show the business target and the forecast as two separate numbers instead of averaging them into one comfortable answer.",
        "Define the evidence or milestone that should trigger an estimate update and keep the previous forecast for calibration."
      ],
      "workedExample": {
        "title": "The twelve-week migration",
        "setup": "A steering group wants a migration completed in twelve weeks. The project plan can be drawn to fit twelve weeks, but the closest completed projects took sixteen to twenty-four weeks and all had fewer dependencies.",
        "weakReview": "The team adds a small buffer to the twelve-week target and calls the result conservative.",
        "strongerReview": "The team starts with the comparable-project range, explains which current differences could justify moving within that range and reports the twelve-week date separately as a business target that would require explicit scope, capacity or risk changes."
      },
      "decisionRecord": [
        "Business target and reason for it.",
        "Independent forecast range.",
        "Reference class and why it is comparable.",
        "Assumptions that drive the fast and slow cases.",
        "Update trigger and previous forecast for later calibration."
      ],
      "comparisonSlugs": [],
      "researchNoteSlugs": ["planning-fallacy-project-estimates-outside-view"],
      "evidenceBoundary": "Planning fallacy, anchoring and availability are plausible lenses for the reasoning process. Real delivery also depends on scope, skills, dependencies, incentives and technical constraints, so a late project is not proof of a cognitive bias.",
      "sourceBoundary": "The guide reuses the project's reviewed planning-fallacy synthesis and anchoring evidence. Reference-class forecasting is a practical procedure, not a universal correction formula."
    },
    {
      "situation": "negotiation",
      "tier": "deep",
      "reviewedAt": "2026-09-10",
      "hook": "The first number is information, not gravity.",
      "problemQuestion": "How do we use the other side's offer without letting it define our range?",
      "whyHard": [
        "Negotiations often begin with a number before both sides have exposed the evidence behind it. That number can become the reference point for later judgments, while public positions make it harder to update without feeling inconsistent.",
        "A better process keeps the independent range, the reservation point and the reasons for changing them visible. The goal is not to ignore the first offer. It is to evaluate it as new information instead of quietly rebuilding the whole analysis around it."
      ],
      "reviewProtocol": [
        "Set an independent target range, reservation point and best alternative before receiving or discussing the other side's first number.",
        "Write the evidence behind the range: comparable prices, value, costs, constraints and important unknowns.",
        "Separate underlying interests from the public position so more than one package can satisfy the real objective.",
        "Define which new facts would move the reservation point and which facts would not.",
        "After an anchor arrives, recalculate from the evidence before making a counteroffer instead of starting from the other side's number."
      ],
      "workedExample": {
        "title": "The 180k opening offer",
        "setup": "A vendor opens at 180k. Before the call, the buyer's comparable deals and internal value model supported a range around 120k to 140k.",
        "weakReview": "The team treats 180k as the new reality and argues about whether a midpoint near 160k would be a fair compromise.",
        "strongerReview": "The team returns to the independent range, checks whether the offer revealed any new facts, updates only for evidence that matters and builds a counterproposal around price, scope and terms rather than splitting the first number."
      },
      "decisionRecord": [
        "Independent target range before the first offer.",
        "Reservation point and best alternative.",
        "Evidence and comparables behind the range.",
        "Facts that would justify an update.",
        "Alternative packages that protect the same interests."
      ],
      "comparisonSlugs": [],
      "researchNoteSlugs": [],
      "evidenceBoundary": "Anchoring is well supported in numerical judgment, but a negotiation also depends on alternatives, information, incentives and bargaining power. Movement toward an opening offer is not, by itself, proof that anchoring caused the decision.",
      "sourceBoundary": "This guide uses the project's anchoring evidence and existing negotiation practice. It is a decision-review procedure, not legal or commercial advice."
    },
    {
      "situation": "ai-assisted-research",
      "tier": "deep",
      "reviewedAt": "2026-09-10",
      "searchIntent": "ai-assisted-decisions",
      "hook": "Three fluent answers are still one model conversation, not three independent sources.",
      "problemQuestion": "How do I use AI to move faster without letting the model choose the frame and verify itself?",
      "whyHard": [